name,price,img,link
Quà cho NGUYỄN KHẮC NĂNG (N-C-G),200000,https://picsum.photos/200,https://shope.ee/link_affiliate
Quà cho TÔ THỊ HÀ (O-I-A),200000,https://picsum.photos/200,https://shope.ee/link_affiliate
Quà cho NGUYỄN MINH NAM (N-H-M),200000,https://picsum.photos/200,https://shope.ee/link_affiliate
Quà cho THÂN THỊ KIM ANH (N-I-M-H),200000,https://picsum.photos/200,https://shope.ee/link_affiliate
Quà cho NGUYỄN TÔ NGÂN AN (N-O-N-N),200000,https://picsum.photos/200,https://shope.ee/link_affiliate
Quà cho NGUYỄN THỊ MINH HẰNG (N-I-H-G),200000,https://picsum.photos/200,https://shope.ee/link_affiliate
Quà cho NGÔ QUÝ CƯỜNG (O-Y-G),200000,https://picsum.photos/200,https://shope.ee/link_affiliate
Quà cho NGÔ GIA BÁCH (O-A-H),200000,https://picsum.photos/200,https://shope.ee/link_affiliate
Quà cho NGÔ GIA LINH (O-A-H),200000,https://picsum.photos/200,https://shope.ee/link_affiliate
Quà cho NGUYỄN THỊ MINH PHƯƠNG (N-I-H-G),200000,https://picsum.photos/200,https://shope.ee/link_affiliate
Quà cho HOÀNG ANH DŨNG (G-H-G),200000,https://picsum.photos/200,https://shope.ee/link_affiliate
Quà cho HOÀNG HẢI VINH (G-I-H),200000,https://picsum.photos/200,https://shope.ee/link_affiliate
Quà cho TÔ KIM HUỆ (O-M-E),200000,https://picsum.photos/200,https://shope.ee/link_affiliate
Quà cho NGUYỄN TUẤN ANH (N-N-H),200000,https://picsum.photos/200,https://shope.ee/link_affiliate
Quà cho NGUYỄN THẾ ANH (N-E-H),200000,https://picsum.photos/200,https://shope.ee/link_affiliate
Quà cho NGÔ THỊ MAI (O-I-I),200000,https://picsum.photos/200,https://shope.ee/link_affiliate
Quà cho TÔ VIỆT HƯNG (O-T-G),200000,https://picsum.photos/200,https://shope.ee/link_affiliate
Quà cho TÔ THỊ HỒNG (O-I-G),200000,https://picsum.photos/200,https://shope.ee/link_affiliate
Quà cho VŨ VĂN HIỆP (U-N-P),200000,https://picsum.photos/200,https://shope.ee/link_affiliate
Quà cho NGUYỄN THỊ CHI (N-I-I),200000,https://picsum.photos/200,https://shope.ee/link_affiliate
Quà cho NGUYỄN TẤN BẮC (N-N-C),200000,https://picsum.photos/200,https://shope.ee/link_affiliate
Quà cho NGUYỄN THỊ TÂM (N-I-M),200000,https://picsum.photos/200,https://shope.ee/link_affiliate
Quà cho THÂN VĂN GIỮ (N-N-U),200000,https://picsum.photos/200,https://shope.ee/link_affiliate
Quà cho NGUYỄN THỊ BÌNH (N-I-H),200000,https://picsum.photos/200,https://shope.ee/link_affiliate
Quà cho THÂN THỊ BÍCH NGUYỆT (N-I-H-T),200000,https://picsum.photos/200,https://shope.ee/link_affiliate
Quà cho THÂN VĂN TUẤN (N-N-N),200000,https://picsum.photos/200,https://shope.ee/link_affiliate
Quà cho THÂN YẾN NHI (N-N-I),200000,https://picsum.photos/200,https://shope.ee/link_affiliate
Quà cho LÊ THỊ PHƯƠNG (E-I-G),200000,https://picsum.photos/200,https://shope.ee/link_affiliate
Quà cho NGUYỄN HOÀI NAM (N-I-M),200000,https://picsum.photos/200,https://shope.ee/link_affiliate
